article_url,site,review_date,verdict,severity,category,issue_detail,why_it_matters,suggested_solution
https://coincu.com/markets/gate-institutional-weekly-report-btc-funding-rate-positive-cex-tradfi-volume-soars/,Coincu,2026-04-03,Revise,High,Originality,"The article likely functions mainly as a rewrite of a Gate Institutional weekly report rather than adding substantial original reporting or analysis.","People-first guidance favors content with substantial added value, not thin derivative summaries.","Add original analysis comparing current funding and volume conditions with prior weeks and explain what changed."
https://coincu.com/markets/gate-institutional-weekly-report-btc-funding-rate-positive-cex-tradfi-volume-soars/,Coincu,2026-04-03,Revise,High,Primary sourcing,"The core market claims appear to depend on Gate Institutional reporting and should be tied directly to the underlying report or dataset.","Financial and market-data content needs clear attribution and evidence to build trust.","Link directly to the Gate Institutional report and identify which figures come from Gate versus Coincu's interpretation."
https://coincu.com/markets/gate-institutional-weekly-report-btc-funding-rate-positive-cex-tradfi-volume-soars/,Coincu,2026-04-03,Revise,High,Title-to-body alignment,"The title compresses multiple signals into one headline: positive BTC funding, rising CEX volume, and rising TradFi volume.","A headline with multiple data claims needs matching evidence and structure in the body or it feels stitched together.","Structure the article into separate sections for funding rate, CEX volume, and TradFi volume, then add a synthesis section."
https://coincu.com/markets/gate-institutional-weekly-report-btc-funding-rate-positive-cex-tradfi-volume-soars/,Coincu,2026-04-03,Revise,Medium,User value,"Without added interpretation, readers may finish with only a restatement of an institutional note.","Helpful content should leave readers with clearer understanding, not just a shorter rewrite of another source.","Add a table with metric, latest reading, prior reading, and why traders should care."
https://coincu.com/markets/gate-institutional-weekly-report-btc-funding-rate-positive-cex-tradfi-volume-soars/,Coincu,2026-04-03,Revise,Medium,Audience clarity,"Terms like funding rate, CEX, and TradFi volume may be used without enough framing for general readers.","Even market-savvy content should define key terms briefly so readers can follow the argument.","Add a one-sentence explanation of funding rate and a short note clarifying what TradFi volume refers to."
https://coincu.com/markets/gate-institutional-weekly-report-btc-funding-rate-positive-cex-tradfi-volume-soars/,Coincu,2026-04-03,Revise,Medium,Internal linking,"This article type only works well when internal links go to tightly relevant market-structure pages.","Weakly related links dilute topical coherence and reduce user value.","Use links to related BTC funding, ETF flow, exchange-volume, or institutional-market pages only."
https://coincu.com/markets/gate-institutional-weekly-report-btc-funding-rate-positive-cex-tradfi-volume-soars/,Coincu,2026-04-03,Revise,Low,Visual support,"This is a data-driven market article and likely benefits from a supporting chart or comparison table.","A visual can improve comprehension and trust for funding-rate and volume claims.","Add a chart of BTC funding-rate trend or a simple table comparing CEX and TradFi volume changes."
https://coincu.com/markets/gate-institutional-weekly-report-btc-funding-rate-positive-cex-tradfi-volume-soars/,Coincu,2026-04-03,Revise,Low,Trust signals,"If the article does not clearly separate sourced facts from Coincu interpretation, trust is reduced.","Readers need to know what is reported, what is measured, and what is editorial interpretation.","Label source-derived figures clearly and separate them from commentary or inference."
