review_date,url,issue_id,severity,category,issue_detail,why_it_matters,suggested_solution
2026-03-30,https://coincu.com/markets/bitcoin-resistance-level-72500-pressure-coming-months/,1,High,Primary sourcing,"The article attributes the core thesis to CryptoQuant analyst Darkfost but supports it with secondary coverage instead of a direct CryptoQuant source, chart, or analyst note.","For market analysis, readers should be able to inspect the original source behind the metric and thesis rather than rely on a rewrite of it.","Link directly to the original CryptoQuant analysis, chart, or analyst thread. If the source is paywalled, clearly state that the article is summarizing third-party reporting and quote the methodology more precisely."
2026-03-30,https://coincu.com/markets/bitcoin-resistance-level-72500-pressure-coming-months/,2,High,Originality,"The article is a strong synthesis of one analyst thesis and related market context, but it adds limited independent analysis beyond expanding the bearish interpretation.","Google's helpful-content guidance favors pages that add substantial value beyond summarizing other sources.","Add a layer of original analysis, such as a comparison table of prior bear-cycle periods, a direct contrast with the current cycle, or a summary of adjusted realized price, spot price, supply in loss, and time spent below the threshold."
2026-03-30,https://coincu.com/markets/bitcoin-resistance-level-72500-pressure-coming-months/,3,Medium,Link-target mismatch,"In the FAQ, the anchor text 'spot Bitcoin ETFs' links to a Coincu article about bearish BTC and ETH funding rates rather than ETF flows.","Anchor text should accurately describe the destination. A mismatch weakens user trust and link quality.","Replace that link with an actual spot-Bitcoin-ETF article, or remove the link and keep the phrase unlinked."
2026-03-30,https://coincu.com/markets/bitcoin-resistance-level-72500-pressure-coming-months/,4,Medium,Evidence stacking,"The article mixes on-chain metrics, macro claims, sentiment claims, and institutional-flow assumptions, but some of those expansions are not sourced tightly enough inside the article.","Readers need a clear line between directly sourced evidence and editorial interpretation, especially in financial content.","Mark the evidentiary boundary more clearly by distinguishing what comes from Darkfost, what comes from market data, and what is Coincu's own scenario analysis."
2026-03-30,https://coincu.com/markets/bitcoin-resistance-level-72500-pressure-coming-months/,5,Medium,Trust signals,"The author bio shows general writing experience but does not establish deep crypto-market or on-chain-analysis expertise.","Stronger topical trust signals matter more for financial-market interpretation pieces.","Strengthen the author page or editorial note with crypto-specific credentials, market-analysis background, or a clearer editorial-review process."
2026-03-30,https://coincu.com/markets/bitcoin-resistance-level-72500-pressure-coming-months/,6,Low,Forecast framing,"The title and body say selling pressure may persist for months, which is mostly qualified in the body but still leans predictive.","Predictive framing in financial content should remain clearly conditional and evidence-based.","Keep the forecast explicitly conditional in the title or dek, for example by stating that historical bear-market patterns suggest the pressure could persist for months."
2026-03-30,https://coincu.com/markets/bitcoin-resistance-level-72500-pressure-coming-months/,7,Low,FAQ utility,"The FAQ is helpful but some answers mostly restate earlier sections instead of adding new value.","FAQ sections work best when they compress, clarify, or resolve likely reader questions rather than repeat the article.","Shorten the FAQ answers and use them to clarify methodology, invalidation levels, and the specific data readers should watch next."
